{
  "schema_version": "sp-202-v0",
  "task_id": "SP202-DOCS-001",
  "branch": "codex/sp202-studiopilot-packet-schemas-v0",
  "changed_files": [
    "schemas/studiopilot_task_packet.schema.json",
    "schemas/studiopilot_execution_report.schema.json",
    "schemas/studiopilot_review_packet.schema.json",
    "schemas/studiopilot_human_decision.schema.json",
    "docs/control-plane/STUDIOPILOT_PACKET_SCHEMAS.md"
  ],
  "commands_run": [
    ".\\.venv312\\Scripts\\python.exe scripts/operator/validate_json_artifacts.py",
    ".\\.venv312\\Scripts\\python.exe -m json.tool schemas/studiopilot_task_packet.schema.json"
  ],
  "commands_skipped": [
    "benchmarks",
    "training",
    "runtime tests"
  ],
  "validation_results": [
    {
      "name": "json_parseability",
      "status": "PASS",
      "details": "Schemas and fixtures parse as JSON."
    }
  ],
  "tests_passed": 0,
  "tests_failed": 0,
  "known_risks": [
    "strict validator mapping may not cover new packet families until future PRs"
  ],
  "scope_deviation": "NONE",
  "claim_verdict": "NO_CLAIM_ALLOWED"
}

